"UCjfhoQKkyf9_FbqhTFjejYA, He&#39;s probably the funniest NBA player of all time."
"UCoLxEkyMoMfL5qJe4PPiPcw, Shaq seems like the dude that will tell you some funny shit during practice while the coach is explaining something serious. Then you&#39;ll get called out by the coach for laughing while Shaq doesn&#39;t get in trouble at all."
"UCE4enVm8SylNnei20vddvjw, At his height and weight if he was more serious people would be scared of him but him being funny kinda makes you look at him like a big teddy bear 😂"
"UCo3g2HaYNf5SQoy6KCqjO7w, I teared up like 5 different times😭 Dude worked hard and played hard. There will never be another SHAQ!"
"UCq5IdlhAx1xuAA5V1Nl4VcA, LOL there will not be another Shaq in NBA history that&#39;s just funny as him"
"UCrY3yuDqoGMYXwysh3s8UDA, This man has lived an awesome life so far. May he continue that way."
"UC4Dx4ThnuYkZaABNHi5pCAg, He is the ONE!  He made the sport fun! Just love him💜"
"UCQ76tVuH4eX58ps8s34LJiw, Shaq needs to be in more movies, seriously one of the funniest people ever"
"UCfsKSfEZN4lQXXvu8PHTZ0g, Shaq is the dude you try and yell at but he is so funny you can&#39;t even be serious or stay mad. 😂😂"
"UCxqUaQybNx5zhJ-p-fi5iow, When I was a kid I was happy that Shaq was an nba star because I thought a man that big needs to be a millionaire so he can get everything custom made. His car, his bed;, his bathtub. Literally everything. He’s the one athlete who can make you glad he’s richer than the rest of us."
"UCkgTXiPHOoaOv0Jpc5bu0Vw, Shaq has more funny moments than free throws made. Great compilation!"
"UC_miy2wHKYU3b_x_8csPPSw, Shaq is the definition of a &quot;Gentle Giant&quot;"
"UCu5ekKhxtKMzvfYECRNqw6g, he is not just a basketball player, he is an entertainer"
"UCUQ5Fj4HaSYqunja6-sfnEQ, He is more than the game. Thats why NBA loves him soo much"
"UCc4vIIEpIYRMBoeLuQA94bA, Shaq is like a little child running around :)"
"UCsqtwHwwJva8lXh3qqhn72A, His breakdance always made me laugh."
"UCCiG046eiAYjCqW9xDm__2g, Que tiempos aquellos, serán inolvidables ♥️"
"UCwCPHwGce5_o_F0QKTTbxgw, Shaq is a big kid at heart he reminds me of my younger Brother he was 7&#39;1 500lbs he was a monster who didn&#39;t know how strong he really was,, he was playing with me one time and damn near knocked me out.. miss you bro..."
"UC6IHDJuwfTE7vutKvIWiubg, Shaq... undescribable! LOVE Shaq!"
"UCXy3Nheoq_cLP3ix-pJE30Q, Shaq is the coolest guy ever ."
"UCTwu8V9C254L3ZE66jhYEWA, Every group must have someone like Shaq 💯"
"UChs2kCrSoHHIK5dEtK5X_gg, Shaq was the shit. I used to watch him as kid in his prime. He was just fun to watch, always had a good sense of humor"
"UCwZ85OYjmUcJrweEahWWWQQ, It must be killing him to be stuck indoors, Pandemic April 2020, since he is such a people person.  Thankfully YouTube let&#39;s us share his greatness for all time.   Thank You, Shaq."
"UChrjpBLOXQzCstSewyZIvVQ, He is a real entertainer, God bless him."
"UCd5YzGeMIVmX2ESaK3JjBgg, Nunca habrá otro como saq esto ocurre una vez en la vida, gracias x todos esos grandes partidos y x ti ke eres un gran sowman"
"UClVMXFE0s9pjKhyLApRxKuQ, brought tears in my eyes. RIP CHAMP"
"UCJ_lIq9m_mxzTak6ZfEF5sA, I was never a fan of Shaq as a player, but I&#39;ve grown to love the man."
"UC1Tq_ZXyxKo8yaZZe2KlgYw, Man spends more time on the ground than standing up 😂 love him!"
"UCPNsnznvD_RgQLFX7Ikr7xA, He&#39;s really and literally larger than life! Great guy!"
"UCLZUqfJ-yDDbYhLnP4-R2Bw, Big Man! Big Shaq! Big Heart!"
"UCpFTQCrIQ1zZXkDhSXXok0A, funniest guy in sports history, ı always missing shaq."
"UCfXH4Qtz6-mvDiMQAtIw5tQ, He&#39;s the best dancer ever!!!😂😂😂"
"UCltqKvVm-U_tTo81JHvV19A, Shaq is like a little kid was trapped in the giant body 🤣🤣🤣🤣"
"UCyhfz3qfcxTA3Rq0FDEjpaQ, Shaq is so down to earth and funny"
"UCwoZZkKcujVYspyPEDsg9oQ, No one can be like shaq, he got his style, his personality.  Everything is cool about him."
"UC7Zuc-Eeo8Lq2jGmy08z0ag, Crazy to think this the dude that would be ready to fight you till the death on the court lol Shaq one of my favs on and off the court"
"UCehObC4QtFuRjnyfDXK2bIA, This is the best thing I&#39;ve ever seen, it made me laugh a lot🤣🤣"
"UCNzJbzk3XBhpDCpkGXEysfQ, I can&#39;t stop watching shaq&#39;s funniest moment"
"UCLPislqwqmoakK05g_J01vA, What a legend!!!!"
"UCRqIpHSNOqk1R98mu4we2WA, he is a giant with a teenager heart .god bless him"
"UC56BcgTtQ9ddQxWrxTUa2Wg, Shaq and his free throws 🤣"
"UC-TaC_bsAdh2ALvZfYWW0PQ, WE ALL LOVE SHAQ!"
"UCzX7VEKfWGLRDRfL2RKr9zg, fun + basketball= Shaquille O&#39;Neil"
"UCz-sBS3QPRXvaD-yltxALiA, it’s heartbreaking that you will never see Kobe and Shaq’s friendship  RIP MAMBA"
"UCE-tGxQnzVadQH3FOdLRYxw, So funny! 🤣 Thanks shaq 👍👍👍👍"
"UC6IkxNRpgb_ExW2iLYb_ZUw, When you have a 30 minute compilation, you know you&#39;re funny."
"UCQ_XLHP1zVvxNAsAsGGY6MA, Truly the only one who didn&#39;t have to remember to have fun...its a game."
"UCaNu0lufbAXBTLUGoTD61kQ, Anyone who brings that many smiles to people’s faces, is simply an angel."
"UCixgxC-D9jLx3kivl0vs_Bw, Watching Shaq is always worth ur money! Always!!!!"
"UCENZOUZzZwBR3EORn8CEc_Q, Shaq is the face of basketball... most likeable player ever..."
"UCs6QpS7KxdsK8ULW9I4YUrw, That is how a true legend looks like ! :D"
"UC_EGtbuuY5lIja_IKM9qXsg, I’ve never seen someone’s soul completely leave their body before😂"
"UCctlappSAJRTVdHyJQMfK9Q, Shaq is so cool. Besides Kobe and the assault. This may be my favorite basketball player of all time and just an all around amazing dude."
"UCiP59G5S_7DNKdcFdnL7HBw, He can worry 😂😂😂😂 I love him"
"UC9RfZenJA3nuTKHnq4WTNeg, Shaq singing and dancing for 25 min straight"
"UCv6NQpCKtYEB_6VzhEY_Pmg, Shaq had the best hand shakes with his teammates"
"UC31IhbmCcwOT2w8KCXqLEGA, He&#39;s a happy human being"
"UCic358kzL6MNRXjK0QA4R9g, The signature victory dance is very unforgettable"
"UCfd_uCRErYOHifb9DWdX7GQ, He is the MVP of all time in born funny guy.Period."
"UCS7Nkp2DdS4vv2_kGzQtjFw, People in 2020: We have Tik Tok People in 2000: We have Shaq 😂"
"UCkLLEvwjdwDhVqTKjDVO95w, LOL he should be a comedian 🤣😂"
"UCDtNda04eIHNbKvClOaSlLQ, Shaq a BOSS and he&#39;s a great human too always being nice and funny he&#39;s great Shaq BIG LOVE coming to you from da UK thanks for everything you&#39;re truly special. Xx"
"UCkt9-QGriA-qdHikZCRUdCg, seeing shaq messing about with Kobe makes me tear up"
"UCsXbjnfRrlHbvWVEAKutwXQ, Kobe ´s death made me discover this gold. Shaq🙏🏽"
"UC35MvwI9IhWJHdTdcQLU2sQ, Omygod hes a big baby he wants a hug from everybody 🤣🤣😂😂"
"UCD7REeAsnTflTWdiFmwGT-w, He&#39;s like a giant teddy bear. 😍😍😍😍"
"UCdxdjGW4F0FE5a8-hnJb0qg, I LITERALLY JUST MET HIM TODAY 😃😃"
"UCNxKhZtNpeCGq-Bv54JhhSg, the true funny legend"
"UC0HVFhG8XFE0MItLwEGTpoQ, Love him so much 😂😘"
"UCD0MNgaBSGiILeBols5yYjA, When he grabbed that guys head like a ball at @   I died! Lmao"
"UCuHgJjDFXt0JKreu-JySPMQ, That&#39;s why we love shaq 😀"
"UCOQ5ChBwCYbOiBSonztzkQQ, Shaquille is the Basket KING KONG ;)))) I LOVE HIM !!!!!!!!!!!!!!!!!!!!!"
"UC3SkQD31m3XOidstsasuWog, If the heart of this person is divided into parts it will be enough for everyone"
"UCY8I7gOZ3UoSkCzLKomRiDA, Yeah big man Shaq is damn weird, hilarious and funny 😆 too."
"UCCGJgvephQZzppqv3C4nwgg, LOVE this man so much !!"
"UCi6XnnDaS5hsibOyJu0uikw, Shaq was a mess LOL 😆 ❤"
"UCmUOi-enPxDwiEAvPNFGFIA, The best END ”Tell your mother to call me” 😂😂😭💯"
"UCRWNkyidMjDleAfXd-e5ZPw, ，this is gold😂😂😂"
"UCQ0S02_jP63V4YACE7vuEnA, I love his personality he is hilarious. He needs a sneaker line forget Jordans get them o&#39;neals lol. I think he needs to try his hand at stand up comedy lol"
"UCxQgDNKkeYS5RM-qgpq14GA, We miss you shaq"
"UC-eAVp-I8dTxResXu-SRXxQ, The Karl Malone’s shoes 😂😂😂"
"UCG3h-7cdH6Vjq4rcRyIguLg, Shaq is just wholesome"
"UCaITJ6DZSp_gq-tSYyXdQOw, Shaq. A basketball player which is LEGENDARY  <b>the big shaq</b>"
"UCQzMrct5XyQ9A9XiTOB5fRg, Well for you young kids this was the most dominant force that ever stepped on court"
"UCQUBEiEERNB0SLktjRm1qdw, Fuckin hilarious love it big fella, wish you were still playing, no more humor like it now days"
"UCCKQfjk8keIipD8KWdh1rgw, He is the happiest player in NBA"
"UCAmHsax7EgMuxVPRmrPx8NA, seeing Shaq laughing while Kobe just stands there looking absorbed in the game made me realize why Kobe drove Shaq away from LA...  Kobe must hate fun."
"UCHlor82PG7EIQ2Eq6glLOow, Shaq is the funniest NBA personality of all time and the most dominant"
"UC-oKSPahQPi7uOCgK4zTuGw, 色んな選手と笑いあってて微笑ましいけど、やっぱ不仲説があっただけにコービーと笑いあってるシーンが1番微笑ましいわ"
"UCbpQ6oM2ZdFDZ7ACUkRS61g, Funny guy with a big heart"
"UCqvocb1Q2QBsJjnzPROQJxQ, Esse é o cara!"
"UC2vsHUBHb19ZG1hOm2a144g, Love you shaq 😂"
"UC_VQbyOqfER0Y0fVaQOSjHA, Shaq and those Mickey Mouse ears😄  ❤"
"UCBc6fX3G6PoPXCAMPB3_csQ, Kobe sit in the corner and looks so shy lol"
"UCfaBSLtMdG_1Wmayf0kw_Fg, I’m a simple man, I see Shaq  I click"
"UCJAV8cE0Z5MiOyoAxz7vO6g, 🤣🤣🤣🤣 so down to earth"
"UCO6EfGNYWv5GXaane93cT0g, Shaq is so full of life"
"UC97zjFS-UXqlUZigSK3pYwg, He is a big kid!! Like... a really big, massive giant kid eheh!!"
"UCY1XGsCga32FPfW4h-OjW4g, Shaq lenda"
"UCAXbQLFEgvmcXmb9la2wUog, Is a happy guy !! 👏👏"
"UCcO2rys5Gn8XFjgIRLoITiA, Fue uno de los mejores NBA yeaaaaaaaaa shaq"
"UCeOLGwRBrv13KQvIBm7bJtA, The thumbnail was like: Shaq: Help! This possessed camera is attacking me! Player in Shaq&#39;s team: It&#39;s not attacking you, you are just leaning it towards yourself slowly to make it look like it&#39;s attacking you. (Shaq laughs hysterically)"
"UCX82bSY8cGolSERmnmRVJ1A, When a guy&#39;s funniest moment takes 25 mins long. That&#39;s Shaq"
"UCv6NQpCKtYEB_6VzhEY_Pmg, Shaq is super funny"
"UCHBTxg3LN6_FS4VZoGC8iyA, lmfaoo thats my dad to me when I come home at 3 in the morning"
"UCq7woFOh_gUS4YMOlwhyUNg, Shaq is the man!!"
"UC6xNtZst4zwNqivh5xtdRfA, minus the kobe bashing, shaqs my dude...what a character....one of a kind!"
"UC_7TMpqafx7y9ctry7i0_4w, That&#39;s why i love SHAQ"
"UCVPcy2KMgZnM4jjO7TWw2ag, He is like the representative for the human race if we ever have contact with aliens."
"UCXmZzR2i2kxZixU10JkZqrw, I can’t wait until one day I hopefully get drafted"
"UCO_1fSMgW-JZ4s-6y6rH7aw, We all need more Shaq kobe and MJ these days"
"UCBgkKb6VM6i9nU7LD8YmDzA, I would love to meet him!!🤗"
"UCLjbLXT8hwF3QDx9wHXRL7A, When he was rubbing that guys beard I absolutely died😂 But that damn music😒"
"UCWbH8tUSKoxnJABzm8XqfJA, LSU love shaq University.....he just makes me laugh"
"UCiX2NifQNxP3OqNLIFiyXvg, that first back of the head slap lmao i felt lmaoooooo"
"UCnUgFheV8WLWty1an2dYikw, that smile :(((( RIP BM"
"UCke3tBii1uLqzbtVT6F0wwg, A nice guy !!!😂🤣🤚🏻🇦🇷"
"UClp-ygn0oUim7QwpNFT9I4w, He is a total nut i could not stop laughing"
"UCoaqNzPp0SH3enD9MptciKA, he is crazy just like me hahahaha lol"
"UC9ZLbyVBt31oC9oQwjuXh6w, Shaq&#39;s dancing is the best part"
"UCErTx2MVcKPoQSu5MboPuSw, How can anyone not love Shaq"
"UCGVs2DWUg8bf5NdpzPMuPPQ, Shaq personality larger then life"
"UCgkinY1zoTiZUNoTNNrTgkw, I love Shaq"
"UCzGTz9n8VMJ-_KVzLfkHCrg, He&#39;s so funny, his playmates never would get bored, he&#39;s too much."
"UCjmnh15qYDGfxRIK01w9DEA, I’d be a happy camper also if I was as rich as Shaq!"
"UCmceSBGhmnas_HQPOGxBqRg, omg what a lovely guy"
"UCiJokMVq-kbAM_040Hw_HTg, big goof ball, full of love"
"UCoxNQyrSrgTHn1fURcwDm2A, just how big is that guy that shot was hilarious"
"UC87A8MQIRMQgnYbum7OTxdw, Шак всегда был веселчаком и заводилой!!!"
"UCg6O6GnM2G5-M0G85xYNKAg, I love this man"
"UCaNu0lufbAXBTLUGoTD61kQ, Damn. Imagine having to look out for the propeller when you get out of a helicopter."
"UC0sbGamSuRfdLdTaRGme5MQ, hahaha legend"
"UCJokZoFd21177CBsfiVzGOQ, GREAT VIDEO 🤣👍THANKING YOU"
"UCni61-Q6z-9gx_8vrB2JaKg, In the top 10 greatest"
"UCUTsqK8cu4_-kepD994-LQg, Lol😂😂😂 i like Shaq on cam and off cam"
"UCK2R8MFMFulTjfHKEcSJ5pg, Shaq twerks better than me"
"UCpzjXDuTHjwdciJWybf6szA, Love Shaq"
"UCLVeMhwtx7TOmjG2d-apzqg, Legend.. ty to exist :)   RIP KOBE :&#39;("
"UCQ6SgDDfzEF2C5AjUD7cR0A, Con Razon Aparese en la Pelicula de Scary movie 😂😂😂😂"
"UCVMRTKwvuqPUhupKc8u7rJw, made me laugh when i realized the hatchback shaq got out of @   was a whole ass suburban"
"UCB1KheQ1CMGYJEUF4hUAjqg, The one an only!!!"
"UCE6SWlhSXf034OdqCtX_x7g, No matter where u go with Shaq,u gana have the most fun with him,He&#39;s like a kid stuck in a mans body."
"UCnFSFOJUWnCFzT2RmpJD50g, that music matched up perfectly lol"
"UCXyTA1c7K55J3i7ohuM7IWw, Cali in the Building, Shaq is a BIG KID and I love it have fun Big Fella💯💯💯🍻"
"UC3XW1hK-ryeWHydh7TZ4PtQ, love this guy"
"UCzlDG7dgsgv2QB-rw0KGGGw, Lol That&#39;s Funny 😁  Shaq🤣😆"
"UCe0fpRhgGIw6NOjm11p_UpA, MY FUNNIEST MOMENTS 2 MINUTES..............SHAQ 25 MINS. WE ARE ALL JUST MINIONS LIVING IN SHAQS WORLD"
"UCmVPF_XBTPG1Q6GoRJ0P_2A, I love this guy"
"UCIJHBPfFeGHsxkYNHP4YL8Q, he looked like a titan running"
"UCYX_eMtH8GM-UubewTL_Dxg, He probably got annoying sometimes but most of the time was a joy to be around"
"UC1rCY7AOKaw4BzeEF8yeswg, why is he always jumping into the damn crowd lmao"
"UCdH4VfbqoeELMB_ZR6RKm9Q, Tho he&#39;s funny AF, but he&#39;s gonna crush you on the court."
"UCUfrzgjZP9yHj46ApakPIJg, still waiting for chacuille o&#39;neal to ball"
"UCpEEGmmNUu7ro1xeFaRw89w, RIP Kobe Bryant"
"UCVLs2KW-pib8A7buZ-f2B1w, I know NBA from the beginning and when someone says baseball I think Shak."
"UC-3eoX00Q2L94GmGFykd3OA, gooffy, hahahaha!🤣🤣🤣🤣🤣🤣🤣"
"UCON0cF3fmIe_ZG4Hvy479sA, Joel Embiid comes from behind"
"UCq2OA9k9fAf0aO-5WmttG4Q, Great human being."
"UCYCiaFYtySKMvKv3JvKIWsg, cnt help but to smile and laugh"
"UCAqmqyZCCM2pz04VWgg9gcg, shaq is funny but music is to loud"
"UC246rLddkroBu_chY1b1PTQ, nba all stars was so much fun to watch when shaq was still around. nowadays it&#39;s boring"
"UCHsOvrmamB_l7r9XSs2OQ3Q, 4 something something 3 something something 🤣🤣🤣"
"UCpEpO3dNv1WlmJBqaKpQjdg, Shaq like everybody Big brother"
"UCc2PZ2mxW4kMb62PCTlVExA, His the good guy"
"UCRbzp0cAJmXCqh-Awy5LOSQ, Is it me should or Shaq should win the sexiest man on earth and he should win sexiest toes on earth"
"UCu2gmxzI4TMQ5QlMFSl2wLQ, best guy in the nba"
"UC-ZSxWoeKt7Sn_pr02dWYYA, I love shaq so much no homo"
"UCrTYHQQoATUs-_KCvpQGogg, Big MAN Big ♥️"
"UC7KbiaI98TapW2BZ14FPBAg, RIP kobe"
"UCrfukonSIcY2viFrXCMOBvQ, must be like getting smacked by the titanic"
"UCI4oFSNkf2cs2ke580cEPBQ, isn&#39;t that Barack Obama behind Shaq 😂😂😂😂😂"
"UCcmC_o9vgi_wi8kZYEz39fA, Funniest giant in sports history"
"UCs-arlfMqRty8dGSprwxk_Q, I had possibility to see his game on 90s.."
"UCi1NNaqi0hbwKtZZwJ9QjTw, my dumbass would have forgotten to lift my kneecaps"
"UCg88tfl-KgVUNIlX8BSoHnw, MJ. King Lebron. Kobe. Sheq. Those are My Boys."
"UCBN__KbsfElRMcAlTU-JsIg, Funniest athlete ever"
"UCZYF2_sgG7L63qqxHn-dk1g, Literally just saw a 25minutes video of shaq being shaq"
"UChaewQuIcqeeELQfVhAyc3g, I hope to see Shaq"
"UCE9n7wM5emluWWMowHc1zKQ, コービーと一緒にうつってるの出てきてやられた"
"UCWTVYJgmwgo0G9299_fJCPA, Shaq:....take over the fucking game Reporter:Shaq we&#39;re on live. Shaq:I dont give a shit Reporter:I know"
"UCYwUNUnPwfRhfxo379qKYUw, Love this"
"UCfYJ2y2_O7PMLGky9W-y3xA, I miss Kobe...."
"UCi1sPOn8kO89Nyp_531FLog, sooooo funny man"
"UCx85uqG3CX77q4VsAEMDYMQ, For his size... no need to act scarry 😅"
"UCzvODVAVejsJUqX6l3FpPZQ, CRYING. LITERALLY"
"UCUQUtbuiYF7goSNm28nblDg, He kept making the mother joke to that guy lol"
"UCDVXRH2RnRkZjFhcEJOQu3g, Better than Steph!"
"UCJtPPe5ALj_hqSyt8vKqDjw, Did this video just prove the existence of Kazam?!"
"UCrYJyRDB35qNV6CXKa7i20w, Kobe 🙏RIP 😢"
"UCbXyQZwyP6ob9YsX2OA7bfQ, Na idade que está se voltasse a jogar daria um banho nessa molecada nova"
"UCbf2R1BVkfi5nzBc5UZa8Dw, G O A T!!"
"UCqEablu-5e-amU93lZpL9_g, Shaq is one of a kind... Discipline, hard work, big body, determination to win, helped him succeed on the court, that is to be appreciated, but he never be considered one of big basketball athletes like others, as he could never stay in line with intelligent players that succeeded in this game - Kareem, MJ, Pippen, Bird, Magic, Isiah, Kobe, etc...   Sorry to say, but I have not seen one intelligent statement from this guy, although he may sometimes be funny as hell, IOI... BTW: LeBron even if he had his disrespectful or goofy behaviors, on/off the court, he could always backed it up with intelligent, visionary plays, that Shaq could never do."
"UC_DcMDLxj_ggCqt14IilRjw, R. I. P Kobe Bryant ❗😢🙏🏆🥇🏀🏀🏀"
"UCjVEH0iRWZg6EYJJo7B7ILQ, enlighten me.. is shaq has an enemy in both inside and off the court? as in a totally enemy that hates shaq... is there anyone?"
"UCi5o6hT60b0NX2j9Lro_urA, He looks like agaki but sakuragiki&#39;s personality hahahahaha"
"UCr9hq98BJTG3Jke00beCy9Q, There really wasent a.d.d meds when he was a kid he did poorly in school but I&#39;m pretty sure it worked out perfectly for him and us"
"UCrfolYR9Cs3uK9HcyBxiwUw, rip. 😔"
"UCKiqrONId4aBMePABbEV4NA, Its impossible to don&#39;t like him (-:"
"UCcguVMBGucIATyINIIwfpIg, RIP Shaq 😭"
"UCFxCymyONrWQ6Sb_0-DuF5g, R.I.P Kobe man."
"UCrGY5a2wIncr38TrQso20vw, How he was able to sneak up on the female reporter and hit the buzzer? Lol."
"UC28s3dVbKxyQIcq7wJN1VmQ, Cool vid😂"
"UCEV-4kcTfsZOuQ8s1bmbVfw, BEST PART of the video @  MaaaaaaaaaaaaaaaaaMBA!!!"
"UCUv5NoX3cijLwWFaQDDnoDA, how come javale mcgee being so pissed about shaqtin???"
"UCJnmqTGx8IcgP2hstscFlSQ, the music makes it so u can watch 30 mins of this. it&#39;s fine except for the 5 parts u cant hear what he says"
"UCe96CXku5mJLcxKRs-o21DQ, Great video! Music is too loud."
"UC282zIsVTy5JIoT3FEXSJeg, Shaq own&#39;s the shaqcramento right?"
"UCgz1LSe_Ts2Ovzqct4mt3Xw, The only thing I hate about compilations like this is the music I honestly would prefer no music"
"UC5GVQcT9GR-TyZGUnGdrGNg, kobes white cap🤣🤣🤣🤣🤣🤣🤣🤣🤣🤣🤣🤣🤣🤣🤣🤣🤣🤣🤣🤣🤣"
"UCNGMvuhAdTr4PQaO4JfQKjg, shaqir so 🥰"
"UCG0toF4wI4CYX-a-9LweMhQ, hahaha"
"UCHU1tI0RemlGcF6yklpA5nQ, That was a lot of jelly to be jiggled for 25 minutes."
"UCuH8J1WuVlrGKkuQlU85J3g, Giannis is Shaq&#39;s long lost son"
"UCZIf9QeDodc-gEJbcpFbPDg, Love the Shaq video but hate the background music"
"UCL73esE8FaUByGyIl1Z_DGw, Shaq has beautiful legs oooo🙂🙂🙂"
"UCN79nF1P08ED89yxb2nid2A, miss shaq"
"UC2tH5xkX8A6NB6S4QRggkgQ, Ha!!!   is the best one!!!!!!!!"
"UC3RrJrtjm1xbcSxhzmX31eA, How someone could not  like This guy??!"
"UCWbH8tUSKoxnJABzm8XqfJA, I wish the background music was not so loud"
"UCB4yxYvNPDoIHw3JNII83sg, There is but not Shaw it is Lebron James"
"UCVewvNgGnRr4GeuQdpMORaQ, Shaq is silly. Barkley is funny."
"UCTEMwiEoh73D2yxcaPdUdSA, Wtf 🤣😂"
"UC4KXpvZmIoxuAj77_uj5OCA, Hey can someone give me context about what’s happening in   ? I’m really curious about it"
"UCj7tQ3Tfe0XigLucGwLuBYw, Great vid.  Can you another, minus the world&#39;s most annoying backing track?"
"UCYIcH7udVEIZtroZPoIeJcA, Wow.  Loved that ridiculous over top of everything.  It really made the video....suck."
"UCTBdjIXQs8taGF9OaEUsJWw, Plz take the background music off..it hard 2 understand what he&#39;s saying over the music"
"UCEDu3y-aZx0vpzxV1ZeQhKg, Who is that reporter at  ? KG also mocked him before for his outfit"
"UCellMOIbAtVHKaz-5AEa99w, Big people look small next to Shaq"
"UCboUT9sJ0zQqetE6TtTK-sQ, 😐☹️♥️ Kobe"
"UCRK2O240EMNqZtILyaFbSVg, S o neil will remember fo his funny action as of now i always see her funny blooper hahaha coz i am lonely person wants to smile with my problem and all movie mr. O neil my favorite very good made by god super funny godbless and more longlife"
"UCfEYjO5yf34b61X1nIGA5ZQ, Background music too loud"
"UCKdF1retm1a8sl0TlWtMcRw, I cant hear him over the music"
"UCMSH4RtXfyJsU_KZWtB55Ew, If I was that big, I would be ducking while getting off of helicopters too..."
"UCmvm9AwEHrJsRjT24IGGagA, This Mann bench pressed a grown MAN on an Exercise Ball..!! 😱😬"
"UCTdNRNtq47q0UGAAtSCDqoQ, 8 31 min dam so sad to see. rip mamba"
"UCmoEngrgR4WPCqdxZtFzaMA, Funny👍👍👍"
"UCmrAxuMf1V3DxdUHA8ZpSIg, let that music take over more"
"UC1PTPn2p62dQOsU6nMcCOPg, kobe :("
"UCOq2ZoS-rOo3sCj9TyxusJg, Money means nothing if you’re not having clean fun at no one’s expense. Lakers!"
"UCMBBjeJpS8D8WrxzeJFa9Mg, HUMBLE"
"UCjMXTG27NYVU-50-PTjsJsA, XD"
"UC9N7-EwNLEEkW4GZ3pvlR_A, A massive baby boy"
"UC3lOp9xF2bdL4L4TAW_tLTw, man that&#39;s a great montage but 25 minutes of the same guitar riff lol..."
"UCvEZSwqcnnpnCWv8LucpgGQ, it&#39;s weirs but when he smile he looks like NCT Lucas"
"UCXLr89EbrHbtzwCRJoFENcw, Boys Locker Room:"
"UCFXOEMEZCKKDPDofy8aSsXg, Please lower the music.  I had to skip it I couldn’t hear them talking."
"UCBc6fX3G6PoPXCAMPB3_csQ, What a nasty boy..."
"UC-rI7JLsU2fe__ltsbhzB4A, cameraman was probably shitting himself"
"UCq0vSFvRej-Ar0kfkp1nueA, What a beautiful personality. Licked chucks head like a milk dud."
"UC5Jje3Da5MoHV9Z12xbd17w, some ppl u just know they are peaceful by looking at thier face"
"UC_jzwnueOWM1CFAWNcRAsYA, Kobe Bryant"
"UC65t7CEl8HJcZR-4cC8kPmA, They can never say Shaq isn&#39;t a character"
"UCbebOmUr_hAKprvr2Smobsw, i like ya cut g"
"UCiiAM4UKTTmunErozN5BUEg, I couldn’t hear most of this because of the music."
"UC_n5KjqUSj8XETtIQxk3aWQ, Se la vaciló.. y se la sigue vacilando.."
"UCCKYqBZ93EgzNGtpLdPa06Q, Big ass kid!"
"UC3p_llSmmpPnwco-Xr_1CTQ, He is like Killer Bee from Naruto"
"UCEyoVzqyb2FIoDOLfL8xo0w, Hahaha"
"UC_LIZEUaJ9RrtvEeZh2k_Xw,"
"UC2rl2gh19SnYmKj7-LwGAtQ, hahaha haaaaa hahaha"
"UCm7qPOvvhx-xMa-RGq9NTQg, shaq that one joker in class but we cant hate unlike the other jokers"
"UCSsNq4U2wOipxp7daJSPuaw, quick tip dont add music like this one anywhere anymore"
"UC3EerxJ2AhhAniMu_Rza_qw, What a life."
"UCNFQwhRZo74TCpan-uOMFFg, Te man si funniest players of rhe leage"
"UCbaWFyI2ZRO42wLQJuo0tEw, How about a little less of that pointless, awful music in the background so we can actually hear what he&#39;s saying..."
"UC8CTPtHNo3OOQTvLcfPN2AQ, What happened here?  What was the call?"
"UCmf5aO8F7wdWOJw0x-8wM5A, I saw a rich man in a capitalist country. He seems very happy."
"UCpeQI8jIkXd0sKRtVQ10kBw, :("
"UCYX_eMtH8GM-UubewTL_Dxg, Yeah the music does mess it up"
"UCfzPom8EHo301MRM6Vxi7NA, 거의 말년 병장인데"
"UC3QgJG6XUyo4WrKxYUmkIDg, Where is   footage from"
"UCTSIzutLftT3Y7vhL5n11tQ, is that lebron wearing striped shirt?"
"UCoaqNzPp0SH3enD9MptciKA, its was hilirious wa ta rah herbou liya f deek lahda xeftha maxé mera maxé jouj o baké kanhes b nafs al ihsas"
"UCfAQyIORBoGEZI0HNUJpQWA, turn the music down, can&#39;t hear the funnies."
"UCcvR-nyzxeFiNFi9B6skTOw,"
"UC8At5HvjgXx0H0tEDyAv-oA, Веселый пингвин."
"UCUcHwkaH_qe9AKlwmxfnAkA, Good hart"
"UCEfPKr1YRC62asOyYqj7Keg, Lool did u have this annoying music playing the whole video 🙄😭😭"
"UCqQr-c3lW_F0CubSIRu1dMg, at   he look so alike kanye"
"UCNTNKDjCq76e__yGHaFQeYw, Wtf"
"UCE9KjBZQkh6kGVoIJXGH40Q, If only the bg music was louder"
"UC9yUhcBfBpeXRQyA7wH27FA, sadly missed 24 Mumba hay"
"UC_EyS-B2NgLNOdw4uNa6zsA, Remove the damn music!"
"UCjkXIbC72JHhiESdz23BxKA, the music is annoying"
"UCCRN31azhE9WHFmXluuBSuA, So funny....lovely naughty boys,,,Kobe but skinny innocent shy"
"UC0X8fCkde41OI8XNXpt20UQ, Why the fuck is the background music so god damn loud"
"UCzo6sKE-3-ID5zqKLt4wYog, reason y she never bored"
"UCxmtPqXmr31JmcpqT8qRxGQ, Shaquille where on live I Dont Give A Shit"
"UCpZW1FH_c_fuyDt2YnxAYNQ, Привет вам из 2021, где музыка из этого видео используется в рекламе грандказино…."
"UClvm29Hev_Xv8XfL34oWIVQ, I cant hear a word because of that damn music....."
"UCHjOY2n2uBv9AQEiwlGHCTw, Stef Michel Kobe Lebron Shaq"
"UCB4yxYvNPDoIHw3JNII83sg, I mean shaq"
"UCw5A4RPl3iRoQrDu1zDVQsQ, Anyone else only make it 10 minutes in cuz the music was annoying?"
"UC0XCKor4cpKV5cUTRL58UiA, What&#39;s the background music for?"
"UCsHv6HZHzTjUSg7YgUE_S9w, Ah ah ah ah ah Is incredibul ah ah ah"
"UCqKhJegWeaYZQo3Kao56_AA, This music ruinned the video wtf"
"UC9EAzdKl6H-S4_z7vWCgYHQ, Funny giant"
